Reviewer,Title,Review,Rating
mattgailey,Service is exceptional,"So pleasantly surprised by this beautiful hotel! Clean room, well appointed with everything we needed including a full kitchen, snacks, drinks and coffee. I loved the charm and quaintness of the property and the staff were super friendly and helpful. I loved the ocean view, easy access to La Jolla along with the complimentary drinks, coffee and cookies in the lobby. Breakfast was absolutely delicious! I highly recommend a visit to the Pantai Inn. I don't have one single complaint about this beautiful property. Upon check out the hotel staff provided us with soda and water for our trip home, which I thought was a nice bonus to an already great stay.",4
Sunseeker73,Gem by the ocean,"My Daughter, Granddaughter and I had an excellent comfortable stay. The room was very clean. We felt safe and secure! The staff was friendly and they also had tasty snacks in the room. It’s a must stay for a convenient and hospitable location.",1
kfinkb864693,Fabulous place to stay in La Jolla,Great place! Great location! Great Views! Great employees. I am not going to share our room number because we want that same room available the next time we come back :) Thanks for all of the special touches you added for our anniversary!,5
sdemit940428,Pantaiii,"I cannot say enough things about this boutique hotel. It was AMAZING!! From the time we got there we were treated like we were at a fancy 5 star resort. The staff was amazing!! The proximity to the Cove and the city is perfect. The room was beautiful and we didn't need to leave the area. When we ventured off, we quickly realized we were already in the perfect spot. We look forward to returning to the location. A million thanks to the manager (sorry I lost your card), to Alan and to all the fabulous staff members who made it so hard for us to leave!!!! :)",1
Discover66581569568,Great time,"There was a small issue with the correct discount being applied and I received and email after I left addressing and correcting the issue. I didn’t put up much of a fuss, so I appreciate the proactive fix.",5
Blake Hanline,Vacation,A bit of Heaven on earth. Really the only way to describe it. From the amazing staff ( Chelsea & co.) to the exceptional display for breakfast with views for miles. My biggest complaint: I had to leave. We can’t wait to get back. Thanks for making our stay so amazing. 🙏🏽🙌🏽,3
thanline,Love the Pantai Inn!,"We so enjoyed our stay at your beautiful Inn. The location was fantastic — walking distance to so many places on either side, delicious breakfasts included, free parking, wonderful customer service. We will hopefully be back someday! Our two bedroom was very spacious and had a large central room to hang out, relax, play games. We loved the fire pit on the property after a day of sightseeing.",1
FunSummerVacation,We love the Pantai Inn!!!,"We had a wonderful stay. The service and location can't be beat. The outside areas were beautiful and peaceful. We enjoyed the waterfalls, space heaters and comfortable seating at night. The beverages in the lobby along with snacks were much appreciated.",5
ddave2016,3rd stay - loved it again!,"I love the Pantai Inn, the staff very warm and friendly. Room superb, clean spacious, great ocean view. I absolutely hated to leave but looking forward to my next visit..thanks to all at the staff and especially Mike at the Pantai Inn for all you do to make my get away so special....",1
John M,Excellent hotel with lots of personal touches,"Great, excellent service, made sure the rooms were clean. Chelsea did an amazing job keeping us comfortable always giving us options where to eat, swim and etc. breakfast awesome as well nothing really",4
Liora H,Amazing,This was our second stay at the Pantai Inn and it was just as wonderful as the first time! We stayed in a different room and we loved it! Perfect location. Quiet. All the amenities you might need. Beautiful views. Breakfast was incredible. Chelsea and the rest of the staff made the visit exceptional!,4
Darlene K,30th Anniversary,We love the Pantai Inn!! The Staff is exceptional. The location is perfect. Can't beat the ocean views. We have stayed here since it opened and will continue to return year after year with our family.,1
Tucsonan1940,Location and Service,"This was our 3rd time staying at Pantai Inn. We loved everything! Their service is amazing and the staff there is very friendly! In fact, at every stay, we’ve seen their service, breakfast, and hospitality improve over the last time, which is rare, but Pantai Inn is doing exactly that! Location is amazing, rooms are comfortable, and they have everything in the rooms to make it a right-at-home experience. Excellent job Pantai Inn!! We’ll be staying there many more times.",5
Hil J,Recent Trip La Jolla Cove Area,"My wife and I stayed at the Pantai Inn for the second time this summer. It was our Anniversary and the hotel had a nice note and fresh fruit in the room to welcome us. This hotel is super relaxing. The breakfast are delicious and you can watch the ocean while you eat. Our room had a kitchen which was great because we didn't have to eat out all the time. On July 4th, the hotel hosted a complimentary BBQ for all the guest. How cool is that! The staff is super friendly and helpful. I've already booked my next stay.",1
Wanderer63535749442,Very pampered!,"Can’t say enough good things about this place.... the location, the atmosphere, the amenities (great breakfast and free snacks / soft drinks every day waiting for us in our room). But the cherry on the cake was the top notch service that was provided by everyone we encountered - over the phone and in person. Thank you Pantai Inn for everything and a very special thanks to Mike for taking care of our week old laundry!!! ;)",5
Blue Surf,Follow Up from Earlier Review: Explore294418 June 2019,"We stayed at the Pantai three years ago and enjoyed our stay so much that when we were thinking about where to go for our anniversary we thought what better place! We haven’t been disappointed and we just got here! Once they learned it was our anniversary, they wasted no time bringing us a yummy dessert plate! They also have complimentary soft drinks, water and Pellegrino along with a yummy breakfast each morning. The location is THE BOMB! You literally walk across the street and are at La Jolla Cove. This place is great to relax or walk just steps up to dining and shopping in La Jolla. It’s a great place to stay when in La Jolla!",3
Ccarroll24,Trip to La Jolla,"The Pantai Inn is a small property (30 rooms) occupying several buildings, ideally located across the street from the ever-changing ocean. It's old but well maintained, and the ambience is homelike. The stretch of coast directly opposite affords absorbing wildlife watching, and there are pocket-sized swimming beaches within a few hundred yards. The Balinese décor is authentic. Our suite was nicely furnished, down to the inclusion of Echo Dot (Alexa smart speaker) devices in both rooms. The bathroom is very small but we found it serviceable for a stay of five nights. Mike, Chelsea, and their colleagues provided attentive, friendly service. The complimentary breakfast is very well prepared by Javier, but the selection is limited. Several excellent restaurants lie within a",1
JimFitz2,A wonderful La Jolla experience.,"One of the nicest hotels I’ve ever stayed in. Our suite was roomy, well furnished and had great ocean view. Best hotel shower I ever experienced (it even had 2 shower heads). Excellent complimentary breakfast each morning and soft drinks and snacks in the afternoon. They also had a private car to take you dinner. Definitely would stay there again.",5
Navigator14553029926,Great place to stay,The friendly staff thought of everything. We had everything we needed and enjoyed our vacation thoroughly. La Jolla is a little paradise and we enjoyed it to the fullest. Breakfast was perfect with view of the ocean. Very comfortable and soft beds.,1
Resort53899933817,Best Inn ever,"This review is a follow up from one that I had posted in mid-June from a stay at the Pantai Inn. In all fairness, the hotel was beautiful and the professionalism and attentiveness of the management is what compelled me to post a follow up. Although we had a few issues as outlined in my earlier review, Mr. Murrell went out his way to understand what our concerns were and to address them in the most expeditious manner possible. To his and the inn's credit, they are continually striving to ensure the best possible experience of the guest; especially when unexpected issues may crop up. I applaud their level of commitment, as it is becoming more of a rarity in today's hospitality community. I will definitely visit the inn again in the future because of their efforts demonstrated by",4
Drew92104,anniversary well spent,We always must stay at the Pantai Inn. Thank you for always being so awesome when we come to visit. Our family loves your facility and we will continue to remain loyal to the staff and facilities. Thank you again,4
Strawberry2468,Amazing hotel,"The Pantai Inn is located in the heart of La Jolla. Beautiful walking trails, snorkeling and kayakingin the Cove, great restaurants and shopping all within walking distance. Pantai Inn is a lovely quiet Inn in the heart of one of the world's most beautiful villages.",1
Ouida W,Best place in LaJolla,"Very nice views of the ocean from the bed in the space. Luxurious bathroom and showering accommodations. Close enough to San Diego to get there quickly but far enough away too for a retreat too. Conveniently located close to beaches, dining, shopping, all within walking distance. I would most definitely choose Pantai Inn again for my next trip to the area.",5
artinboston,Great hotel with excellent service,This was our first getaway in five years and Pantai Inn made it the best vacation ever. We stayed in the room overlooking the beach and the ocean. So beautiful. So restful. We will definitely be returning Pantai this year. Thank You so much!,1
297jaredk,Outstanding Boutique Hotel in La Jolla,Loved this place. the suites in the south building have stunning views and the service was top notch. breakfast was nice in the communal patio (besides the seagulls). Would stay here again 100% Thank you!,5
Climber11959220515,Amazing place!!!,"We loved our stay at the Pantai Inn. Our room was lovely with amazing sea views! The views could absolutely not be beaten, we could even see seals sunbathing and sea lions swimming around from our balcony. The staff were brilliant and made us feel very special, it was our honeymoon and they gave us chocolate covered strawberries and decorated our room. The hotel breakfast is great and there are so many little extras they give you like cookies at reception and crisps and cereal bars in the room. I'd definitely recommend the hotel!",3
roger_53_OK,Pantai,"This was our 2nd visit to Pantai Inn. Last year we stayed 4 nights and this year we increased to 8 nights. We LOVE this place. The staff made our stay so enjoyable and memorable. Every day there is an artistic menu of your next day's breakfast posted in your room, chocolates with a pleasant message on your bed each night, and fresh baked cookies every afternoon. Whatever your needs, they make every attempt to accommodate you. We already have our reservations for June 2020.",1
Climber40393189401,Tim and Jodi Schmidt,"The Pantai is a great boutique hotel. The location is fantastic as it’s right on the water and a short walk to everything. The rooms are very nice, but the staff is fantastic. They bend over backwards to make sure you have a great stay. If even the slightest thing isn’t perfect, they are so conscientious about fixing it quickly and making it up to you. It’s also nice that they offer complementary snacks and water. Overall, we really enjoyed our stay at the Pantai",5
TAEarly,The Jewel Delivers Again,"Best location in La Jolla, across the street from the ocean, steps away from the best restaurants on Prospect Street. They have a wonderful breakfast, great service, easy parking, lovely rooms and reasonable rates.",1
JAIMECHAA,Excellent and great place!!!,"I fell in love with this hotel. Its ina perfect location the room was beautiful. The staff was great. Great breakfast overlooking the ocean, nothings better than that. Walking distance from the water.",4
Extraordinary167232,Great Birthday Weekend,"My wife and 2-16 year olds spent the night at Pantai. What a great property. And even better staff! If you want to stay somewhere that has maintained its quaint history with an appropriate touch of the new, you’ll thoroughly enjoy this property. Breakfast until 11! Excellent management and exceptional staff. Great location. Reasonably priced. This Oklahoman family will be booking our next visit at Pantai with an ocean view and private patio. Thank you, Mike.",4
jsaullo,Worth every penny,"This is an excellent, well maintained property in an excellent location. The staff was very attentive and friendly. The food/breakfast was very good. The ocean view and accessability to all that the ocean has to offer is excellent. it was easy to get to , get in and get out of the property. I would highly recommend the property to anyone.",1
jmarcin01,Short retreat to San Diego,"This was our third straight June to stay at the Pantai Inn, and it keeps getting better. The location is fantastic, and the rooms are very comfortable. What sets the Pantai Inn apart is the staff. Everyone is super friendly and helpful. Chelsea deserves special mention for accommodating our needs for additional items in the room and transportation to restaurants.",5
Voyage46057666691,Tropical Resort,"I am very happy with the atention of Mike and beauty lady in Lobby!!! Was a night wonderfull. my wife and I really enjoyed the room, the wonderful views in front of the ocean, without a doubt in next sample visit to La Jolla we will stay in that nice hotel. For leaving very early we do not take advantage of breakfast, which is free! and it must be delicious. I highly recommend this nice hotel. Thank you Mike!!! JAIME",1
drmary882018,Paradise found La Jolla Cove,"Thank you for a wonderful ocean front stay! Everyone went above and beyond to make it special. From the bday balloons and dessert, to the carafes of fruit infused water that were brought to us simply because I said I liked them. We will be back!",5
Paradise32610275702,"Perfect location, great service!!","The service is unequalled and the view is breathtaking. The staff pay attention to every detail and it is our pleasure to keep returning due to the service provided of Mike, Chelsee and the team. Easy parking and great room size.",3
Roving67797280401,June 2019,"Excellent property - right at La Jolla cove We had a unique opportunity to enjoy one of the best apartments with a full ocean view This is a traditional hotel - so you have to accept that experience may be different than in a top network hotel. Every apartment is different, buildings are traditional bungalows - which means that they can be a little bit accustic, there is only one relatively small bathroom. But in return you get excellent location, attentive staff and very unique San Diego experience",1
toothfairy32,Gem in San Diego!,"We can't say enough about the wonderful time we had at this beautiful resort -- from the uniquely decorated suite, gorgeous view and personalized service to the special handmade touches and specially prepared breakfast each day. Pantai Inn is a very special place!",5
Cruiser47435763636,Honeymoon by the ocean,"We have been so fortunate to be able to frequent Pantai Inn for many years. After staying at all of the other 5 star hotels in the area, we realize that nothing even comes close to Pantai in beauty, comfort and best location. The amazing decor, relaxing energy and brilliant staff make us eager to return. Thank you everyone at Pantai, especially Mike, for making each visit so memorable!",1
Explore294418,OK Stay,"We had a wonderful time at the Pantai Inn!! We were two families traveling together and booked a 3-bedroom accommodation. It worked out great for us and the kids. The property is lovely, especially the landscaping--mm...jasmine!! The location is perfect, close to everything. The staff is the crowning jewel. Everyone is so lovely and helpful, but not intrusive!!",4
Dreamer67150111573,Great Stayk,"Excellent experience. Every member of the staff was friendly, efficient and professional. Our family highly recommends staying here from the ocean access to easy parking and the fresh breakfast each morning.",4
Doug M,"Amazing Anniversary! PANTAI INN La Jolla, California","Oh my gosh, where do I start? This was the most amazing place. The customer service was 10 star. I live in Las Vegas and we have the most amazing hotels with the highest levels of Customer Service but this by far has exceeded my expectations. Everyone and I mean everyone from the phone to rooms cleaning were astounding and friendly. The breakfasts Were excellent and include it. It was our anniversary and they made it an exceptionally special event. I would come back here anytime I go to San Diego. It was extremely close to all the shopping districts and the oceanfront views were beautiful. Thank you so much for making this a memorable anniversary trip. PS forgot to mention the bed hell comfortable. I didn’t want to get out of it in the morning. But the breakfast and the ocean",1
Gina F,"Great stay at Pantai Inn, La Jolla",Beautiful spot in La Jolla with amazing reviews and attention to every detail. They are so responsive to every need. Welcoming and warm staff. Definitely would return for another visit. We had our kids with us for part of the trip and they loved it too.,5
OnAir46248692945,Weekend break,"We rented unit 108, a premium ocean view room. Room was musty smelling along with being able to hear all noises from guests in unit above Housekeeping forgot a bottle of Windex in room and forgot to replace kitchen trash can with new liner.. Staff was friendly, but could not compensate for an inferior accommodation. We will stay in another hotel next time we are in La Jolla.",1
Donna S,Happy Place,Second time staying there. Great service Room was great as well. loved the private patio and great view great location. Staff is always very helpful and friendly. We will be back as soon as we can. Love the place!,5
PerpetualMotion19,Everything was perfect,"I can not say enough...I was having a hard time finding what I was looking for in a place to accomodate my wife, and myself for our Anniversary. We are usually a little hard to please I am sorry to say. Somehow I ran into the Pantai Inn and read the reviews (to myself I said no way). Chelsea picked up the phone and created magic. Voila after spending a short 40 minutes with me. Yes 40 minutes on the phone giving me all the details I could possibly want. I BOOKED. For me that does not happen I always have to investigate, speaking with her put me at ease. It was just so easy and too simple to pass up. By the way the Inn had only 1 room left, and I am still wondering how it is that I was able to get in. Well needless to say our stay was just short of a fantasy ! Meaning it",3
GrandTour134781,Fun ansd Sun,"I give 5+ stars! What a great place! The staff is so friendly and very helpful. Big breakfast every morning - Javier especially friendly and helpful - not to take away from anyone else though. Everyone was great! Parking was a huge bonus! The view from our room was perfect. Open the door in the morning and hear the waves crashing. We go to San Diego at least twice a year to visit family and we will definitely stay here again. We hated to leave. I never wrote a review about a hotel, but I felt I had to with this one because we loved it so much.",1
Tourist60201927399,Great Trip,"Our second stay at the Pantai Inn was as nice as our first, everything was just as we hoped. Great room, great view, great service. It is now our 'go to' place when visiting San Diego. It's location make it perfect for accessing the restaurants and shops without dealing with the parking and traffic.",5
Dr. Ellen Greenfield,Amazing experience!,"This is our 3rd stay and we already have our 4th stay booked for the fall. I can't think of a better place to stay than the Pantai Inn. The staff is awesome. I call this my happy place to be. I highly recommend this as a relaxing, laid back, stress free vacation destination!",1
Rachel S,Beach Paradise,"Great location in downtown La Jolla - can walk to all the restaurants and shops and the cove is almost right across the street. One caveat - you can't walk from here to the beach (ie: La Jolla Shores). The room was huge, with a kitchen, dining area, living room, bedroom and bathroom. The king bed was really comfortable - better than my bed at home. The complimentary snacks and water were much appreciated, and the breakfast was great! The front desk folks were super nice and helpful. We'll be back!",4
Voyage00364718425,Surface Tech Event Stay,"The location was great, and the view spectacular! Loved the turned down service and the chocolates. Excellent recommendations on restaurants and places for live music. The breakfast was a nice variety. The staff was pleasant and accommodating.",4
kathryns489,A natural beauty,"We have a fantastic stay at this location! From check in, until we left everything was great. The entire staff was wonderful the entire time. We had our family, including an infant and will definitely stay here again when we return.",1
robert c,pantai Inn,"This experience at the Pantai Inn was one of my most memorable. We stayed in an oceanfront room that was beautifully appointed and comfortable. The view was breathtaking, the sound of the waves was phenomenal! The staff were helpful, courteous, and welcoming. All around outstanding experience!",5
Cheri Light,"Spectacular service, location and amenities!!!","We stayed at the Pantai Inn over Memorial Day weekend for our anniversary. It was truly a wonderful experience in every way. The customer service was exceptional. We were texted by Mike and Carlos before arrival to see if we needed anything. Carlos did a wonderful job showing us around the hotel. The breakfast chef, unfortunately, I didn't catch his name, was super friendly and accommodating. A delicious free breakfast is included. The housekeeping staff was impeccable. Dalia and Claudia did an amazing job on our room. The room was super clean. They even wiped down the remote every day. This was the best housekeeping I have had at any hotel. I was so impressed by every staff member I interacted with. Everyone was friendly and helpful but not intrusive. They had free drinks and",1
Roving734751,Absolutely Fabulous!,"Best kept secret in La Jolla/San Diego. Location is the highest benefit, so close to Children's Pool in the Cove area of La Jolla. But only by a smidgen, as the overall quality of the Inn and its staff is 5 stars. The individual unit/room set up on property is unique and works harmoniously within the site giving the stay a sense of contained adventure.",5
hipposrock,The ABSOLUTE Best!!,"This was our 4th stay and for us the Pantai Inn is excellent. We hear the waves at night, we swim in LaJolla cove which is a 5 minute walk, we boogie board at nearby beaches, we walk to restaurants and shops and also explore the area on foot and by car. The manager, Mike, is attentive to our needs as is his friendly and capable staff. The breakfast buffet is nutritious and fresh and can be taken on the patio facing the ocean. We like the small kitchen in case we want to eat in our room occasionally. The property is full of small waterfalls, tropical flowers. And.... did I mention the Inn is right on the Pacific ocean!",3
Flyer580360,Wonderful!,"Service was the best. great location, breakfast was very nice...... furniture could be more comfortable. could use some chase lounges on deck. iron railing is annoying . glass would be better for view.",1
Discover08843535005,Enjoyed our stay,"We could not be happier with our stay at Pantai Inn. The location was perfect with views of the La Jolla Cove just steps from our room. The staff could not have been more accommodating from help with the scooter app to lending a laptop for a last minute student. The room was comfortable and quiet. Breakfast was delicious and different each day. Although the hotel is beach front, the town of La Jolla is an easy 5 minute walk with all the shops and restaurants you could ask for. I cannot wait to go back!",5
Chad S,Another stay in May 2019,"I cannot say enough about how wonderful my stay was! The customer service was second to none, the view was incredible, breakfast was phenomenal... I can't wait to come back again. Thank you for everything!",1
vbjoe,Unique and wonderful,We had an amazing stay at this hidden gem right across from the ocean in La Jolla where we celebrated our anniversary. The personalized care from the most-attentive staff was beyond compare. The general Manager was there to greet us upon arrival and say good-bye and thank you upon departure. All the staff we encountered exceeded our expectations as well. The humongous double shower was incredible and the unique spa tub with the gorgeous mural was just one of the ways this Inn made us feel we were actually in Bali and at peace with the world. We couldn't have asked for anything more from the scrumptious chocolate-covered strawberries we received upon check-in to the delicious variety of offerings for breakfast. The location is perfect! We could hear the ocean waves and,4
