Reviewer,Title,Review,Rating
Disneydreamer22,loved it here,"Have just spent 4 comfortable days here.From check in by the fantastic Ronnie such a nice guy ,to a quiet room ,which i didn’t think was going to be as we were at the front where we could see right across and up the river. You could hear the traffic but it just sounds like the wind we were on the 8th floor the traffic did not keep me awake .I could hear a tv slightly at 4 in the morning but again it didn’t keep me awake . There are only 2 things i wasn’t keen on the bed was way too hard and there’s no on-site parking they only do valet parking on a fri/ sat then they take it to a parking lot that you yourselves do about 2 blocks over they do validate the tickets so they cost slightly less i would stay here again",5
Gurudesh,Great location,"Great location but do not expect good service. Seems management does not care. Checking and checkout was great. Staff provided everything that was requested. There was no utensils, cutlery in the room although we had kitchenette. No bath soap in the bathroom. No extra towels. Little disappointed by lack of attention.",3
hancouk,It’s ok but it’s average at best,"We have stayed in CQ Hotels before so we had an idea what to expect and hoped for as good an experience as in previous locations they operate. It wasn’t what we expected, partly to be blamed on the pandemic of course as the accommodations industry is likely still looking to recover from that , plus we are on the brink of recession (or it has started) The reception area focuses on self service and that’s ok. There is help for people who need it. Our room was small, quite cramped for $400 for two nights I think. We were on the 8th floor, in 808. There is no safe in the room, so think about that regarding valuables. The bedroom window was “frosted” and that helped with the fact that the view is of a wall lol We flew into the city and needed to iron a couple of shirts. There was",3
Tony C,River Hotel elevators are fine.,,5
emmahalpin2022,Beautiful building and hotel,"The reviews on the elevator being out at the River Hotel are incorrect. They do have an elevator out in the Club Quarters section of the building that has two hotels. I was concerned reading other reviews about having long waits to the room. So as of August 27, 2022 both are working for the River Hotel. Our Superior River view room is nice, outside of the view of the hideous view of the Trump building. Not to be missed is the 24 hour coffee machine on the second floor. I will say when we got back with our friends from dining and drinks last night the did seem to be a long queue of disgruntled guest waiting for the single Club Quarters elevator.",5
Mairi B,A bit disappointing,"We stayed for an anniversary trip and had a river view—which was breathtaking. The hotel staff were great, it was quiet and clean. Great experience overall. We were able to walk to many attractions and sites easily as well.",3
d g,Great location but that's about it,"We were in town scouting hotels with high school friends for an upcoming reunion, and let me first say that the customer service we encountered in Liz and Ronnie was amazing! The location of this hotel is perfect, close to the river walk and transportation, so we found it very easy to navigate from the hotel. We had a lovely view of the river from one of our windows out of our tiny room. The room however was super small and one had to side step at the bottom of the bed, or crawl over the bed in order to get to the other side. The bathroom was rather small as well, but everything worked and the water pressure was good. The biggest problem was the fact that there was only one working elevator to take guests up to floors 11-35. We heard that the other elevator had been ""out""",2
Sina,The worst stay ever,,1
Rob M,Parking will cost you.,"Pokey rooms, one working lift for 38 floors, ~15 minute queues for elevator. A lot of money for over filled lifts and an average at best stay. We had thought this would be a good candidate for our upcoming reunion. With no good way to get to and from the rooms, it clearly is not on the list.",3
Emmanuel R,Well located in the loop,"I booked this hotel through Booking.com. I filtered for 4-star hotels and this property showed up. However, when I got there, I realized that the hotel is 3-STAR. I contacted the property manager and he also confirm that the hotel is 3-star. Here is his reply ""We are actually a 3-star hotel, We are rated as a 4- star hotel due to guest reviews!"" The hotel room is old and dirty, with a tiny bathroom, no safe box in the room and they do not provide breakfast. The air conditioner was making a shrieking noise. So, be aware that the hotel is actually WORSE than a 3-star hotel. I contacted booking.com and they said they are not responsible for the star rating. Property managers also ignored my messages, and simply ruined my honeymoon. Please see the photo that I posted with this",4
Adam F,"Great Location, Decent Hotel",,5
rktrump,Will absolutely stay here again,"Price was fantastic. Room was basic. There was a pull out couch that turned into a bed. Great views from the front, but really no views from the back of the hotel. Parking is a pain. You have to walk a few blocks and pay $55 a night. Not the worst option, but keep in mind it is downtown. Staff was friendly and helpful.",3
Andrea L,Horrendous,"I went there for a business trip. The hotel is clean, ideally located in the loop along the river. Everything is reachable by walk. My room was a little bit too small with a small window. At that time the breakfast was served in the room but was quite good.",3
manuh620,Location is great,"The location of the hotel is perfect, easily within walking distance of public transportation for attractions and airport connection. The simple offerings of the hotel are just as advertised, however the elevators are confusing and a hassle. Only one of the elevators for Floors 12 and above was working during my stay, and this often meant 5 minute waits to go up or down Otherwise the stay was perfect and the view from the 30+ floors Is great",5
Me_n_my_rucksack,"Exactly what we wanted.... perfect location, clean comfortable and friendly hotel.","I would absolutely stay here again. I sprung for a room with a view of the river. That means I paid more for this hotel than I typically like to for a place where I just need to lay my head. But it turns out it was totally worth it. The view was downright amazing - and so peaceful to look at before heading to bed each night. My 9-year-old son particularly loved this routine. And, the location is great. I may have planned to be out all day, but with this awesome central location, I could pop by the hotel if I needed to in the middle of our adventures. Hardly needed the staff, to be honest. But the couple times I did need something (extra pillows and blankets), they came straight to my room. I read some other reviews that made me think the room would be tiny. It wasn't at",5
susan,"Excellent location, comfortable stay","We were so excited to find such a seemingly nice hotel bailable for a “last minute” booking. We called to insure an early check-in due to our flight arrival being in the morning. We were told we could check in at 11:00. At 11:00 we were told 1:00, then at 1:00 we were told 3:00. We got to the hotel at 2:30 and were told that a room was available and it was an “upgrade”. We paid for a king room with room for a fold out or pack-n-play. The room we were given (704) was extremely tiny, no room for any additional bed, and the window was smaller than a jail cell. Attaching a photo of our “upgraded king bed”, that was 2 twin beds pushed together. There was no breakfast available, the water machine on the floor didn’t work, and we weren’t provided any of the requests we asked for.",3
Hey_girl_hey86,Location!,The hotel is very well situated for a trip to Chicago. Breakfast included shouldn’t be booked. It is not worth it. It is a hassel with the vouchers (usd 25) and fairly expensive for the choice and service you get.,2
Pete S,Location,"When visiting a City you are unfamilliar with it can be hard to trade off price against quality when you know very little about the neighbourhoods etc... we struck very lucky with the Riverside as the price was very reasonable and the location perfect. A 5 or 10 min stroll from Clark on the Blue CTA line the Riverside is located (as the name implies) on the riverside - when you walk out of the front door the view is a real wow.... its within walking distance everything downtown. The location really is spot on. Check in is supposedly carried out via terminals in the lobby, but one of the friendly folks went through it with us. The Building is historic - with a genuine historic feel to it in the entranceway - which could mean dated I guess - but there is absolutley",1
Michele R,Stay away. Overpriced for what you get,"River Hotel is in an excellent location for downtown and all its attractions. Our room was quiet, clean and comfortable. We appreciated the free laundry, the gym and the club room for relaxing during the day. The only thing that could have been improved was the room decor which was dated and a bit gloomy.",3
Paulade,"Location, location !!!",We stayed here for Monsta X concert at the Chicago Theatre. The location of this hotel was absolutely perfect. It’s right in the middle of everything you could need. We parked about 3 blocks away and never needed to drive the entire 4 day stay. Food-entertainment-parks-Navy Pier- you name it. It was absolutely the best place for the money. Surprisingly quiet at night too! We didn’t hear a thing from neighbors or outside.,4
Alexandra S,Ronnie and the QR code,"Great location if interested in Mag Mile and Loop. Available river view rooms. Hotel staff is friendly, welcoming, and accommodating. Check in is easy with Club Quarter App. Easy check out as well. Close to great restaurants and activities. Highly recommended for great value.",5
maumaujr,Location versus price,One of the ugliest hotels I've ever stayed in. The price is absolutely not justified. Breakfast was not available and we were given vouchers for the restaurant next door which weren't enough. The safe was missing. Ugly room with an old bathroom with shower with plastic curtain and no shower gel. No room cleaning service (unacceptable). We asked for two separate beds and they gave us a normal bed and a sofa bed with a mattress full of humps where it was not possible to sleep. Stay away,3
04Stephanie2022,Good hotel for short trip,Hotel is in a great location !! Set on the south bank of the river it’s in the perfect place to explore the north side or the south side !! The room we had was really small with a window (but no view) If the price is really good then it’s a good option !!,3
melodiegarrett,Perfect Location,"Ideal location. Dream view. Comfortable and spacious rooms. I'm not sure that the outsourced breakfast orderable from a QR code and delivered to your room is progress, especially when it is over 30mn late. But this was compensated by ""smooth groove"", jiving Ronnie's warm welcome. He greets you with a smile, a joke, a song, and has solution for everything in ""less than one minute"". It was lovely being greeted in the evening on my way in to the hotel by ""Welcome back, Milady!"" In these days of QR codes, this quality of human service is greatly appreciated.",5
Johan F,"Perfect location, value for money",The best location in Chicago for a very low price... In front of Trump Tower. Close to a lot of atractions! We do almost everything on foot. The best choice at the Loop. Everything was grade 10 (from 0 to 10)!,5
kellygumps1975,Great hotel great price,I came here for a weekend birthday trip. Room wasn’t the biggest but for only two people it got the job done. We spent about 4 hours a day (aside from sleeping) in there and it didn’t feel cramped at all.,3
TravelingWithJ,Quaint hotel in the heart of Chicago,"The location if this hotel is wonderful. Easy access to the many sites to see. The hotel staff was VERY accommodating and helpful. This may be an older hotel compared to most and we did have some trouble with our room, but we were moved to a different room.",2
craol02,Great hotel,Excellent location at the river. Close to magnificent mile and the loop. Room well appointed and clean. Somewhat low pressure in the shower. No cleaning on daily basis due to Covid regulations. Self check-in very simple and quick. Recommended.,1
asalgad01979,Cozy and luxurious.,This was an amazing hotel for the price. Very comfortable beds and pillows(with back issues this is HUGE) there is no resturant but a great roof top right next door. Very clean and easy to navigate. Just remember there is an amazing river view(friends had that room we had city view) so ask for the river rooms 604 for sure had a great view! City view was good also but I went for the green river! Thank goodness friends got the river view so we could see it from above,3
juancovault,The River Hotel,"Stayed 2 days for a conference. Historic building conversion with great access to Michigan Ave. Quiet, updated room, comfortable bed and PILLOWS. Easy app check-in, good WiFi, and chilled purified water on the floor was a plus. Would stay again without hesitation.",4
r0nyd0s02003,Good location and facilities,The staff was phenomenal. The room superseded my expectations. It was amazing. Only issue I would say is the beds are very firm and was a bit uncomfortable for my husband and I. Everything else was fantastic.,5
Kara H,Great value,"Room was cozy, clean and stocked. Staff was polite, welcoming and knowledgeable. I can't wait to go back. Fitness gym, coffee in the rooms, coffee in club living room. Bottled water accessible on every floor as well as ice. It was great.",3
Madaline P,Pictures on line do not reflect realty,"It has a beautiful view. The room was small, but clean. They offer coffee and other drinks free of charge on 2nd. floor. The staff were nice! I just wish the bathroom was better. However, it was clean.",3
Lissie,Coming Back!,"In the downtown center where you can walk to many landmark. Water station at every floor, guest laundry is free. Elevator were old and sometimes problem happened, hope can be maintained better. Parking always an issue in downtown... Can be very expensive, get ready to walk further to get a cheaper parking slot",5
Kimjbaumann,"Great location, attentive staff","The River Hotel is located in a great spot and it’s very easy to walk to popular areas like the Bean, Magnificent Mile, and a lot of shops/restaurants. The price was great for the location. The staff were friendly and the rooms were clean. Would definitely stay here again.",5
tcmalsch,Great location,"Check in/check out-staff didn't offer up any information about the hotel and its amenities. We had to change our room to a larger room last minute to add our son but was never told that we would be charged extra for an additional person in a larger room that was supposed to accommodate 3 people. The pull out bed had no blankets, called for a blanket, waited an hour then went down to the front desk to ask about the blanket in person since we were ready to go to sleep. The pillows were hard as rocks. There was no light in the area of the room where the pull out bed was. I moved one of the lamps by our bed to the pullout bed area and noticed the lamp shade was broken and the screw that holds the shade on was gone. When opening the door to our room, we were on the 9th floor room",3
yagalina57,Great location,"I will like to start by saying that I can't wait to go back! Chicago is my only favorite city in the USA. The view to the river was amazing! Location was an A+ being close to most attractions at walking distance. A 7 eleven around the corner was convienient as well. The check-in was easy through a kiosk and if any issues, they are right there to help you. If you park at 20 E Randolph St. self-parking, the hotel will give you a discount and you pay only $25 for 24hrs. For me, that is a good deal for being parked right in the city. This parking lot is a 6 minute walk from hotel. The hotel and parking lot is a short walking distance to Boat tours, River walk and rest. (accross the street) Nutella, Cloud Gate and other attractions. The hotel was bulit in 1928 and you can tell buy",2
chicagoans,Great Stay Near River!,"We found this hotel to be perfect for our needs, with a central location near Riverwalk, Michigan Avenue, and many restaurants. All the staff was helpful as needed. Only complaint would be that the sofa bed in our room was not adequate for sleeping, was fine as a sofa.",1
GDSM2016,Avoid it!!,"Enjoyed our view and location. We were next door to London house and across street of Trump building! Within walking distance of Millenium park, art museum, state street shopping, Michigan avenue. Rooms were spacious, with micro and small refrigerator. Lobby was clean and front desk very helpful. Price was very reasonable!",3
Pennie41,The rooms,"We enjoyed our stay in a room with a great river view. We booked a Superior Queen room and it included a kitchenette (mini fridge, microwave and a coffee machine) and a sofa and was spacious The shower has a flexible hose which I like better than what most US hotels.have. We liked that the hotel has water station with refillable bottles on each floor - kudos to the hotel for being environmentally friendly The location is great - close to the Riverwalk, the lake and Millennium park. Also the staff is professional, helpful and friendly. Good value for money.",4
Tania M,Great location!,"We stayed at the River Hotel after a wedding, and before the Chicago Triathlon. The front desk staff was very accommodating and friendly. They were flexible with our checkout time after the race, and very nice about checking our bags after that. They even let us check a bike :) I would definitely stay here again!",5
Beauregard70,Made Our Trip to Chicago,"Avoid this hotel at any cost!!! Even though it looks clean and it’s location is superb, THEY DONT CLEAN THE ROOMS. We needed to clean ourselves. The excuse? The pandemic. Pandemic is no excuse for being filthy. Personnel is very friendly though. Anyway, I’m not staying here anymore and I recommend anyone not to as well.",3
Gina M.,Enjoyed our stay,"This hotel allowed dogs, which was not a bad thing. However, my room has a dried urine spot on the floor. I was told (at check-in) that housekeeping doesn't go into every room and that if my room needed anything to call and let them know. The carpet in the rooms need to be cleaned after a family leaves that has a dog.",3
Heather F,"2 star quality, 4 star price.",Great location for an affordable price. Excellent customer service and fast check in and check out. We had an amazing view from our room to the river. Parking available with valet parking service few blocks away. We will stay at The River hotel again for sure!,5
paulgeldridge,Nice,"This was a 3 day / 2 night father/son trip to Chicago. The location was perfect, the facilities were absolutely awesome, and the staff was over the top helpful and friendly. We asked lots of silly tourist questions and they patiently answered all of our questions with a smile. Thank you so much, River Hotel! We will absolutely be back and we will absolutely recommend you!",5
aprilm1232021,Excellent Choice for Your Stay,"Loved the location! The close proximity to trains, River walk, parks, Lake Michigan, museums, restaurants, and shopping made it very easy to see and do everything on our list and more! The complimentary water filling stations are a nice touch and helped us stay hydrated during the week. We also enjoyed the other amenities like the gym, free laundry and espresso machines. On the down side, our room was very small (hubby had to turn sideways to get around the bed it’s so close to wall) and bed was a full sized mattress, not a queen as advertised. this took a little getting used to since my husband and I are both on the taller and bigger side. Bed was not the most comfortable and pillows were too firm for my own personal taste. Most of the hotel staff we interacted with were",3
yourcakequeen,Great place to stay.,"I don’t normally leave negative reviews; but for what I paid for this room, I felt very ripped off. The bed felt like I was sleeping on a piece of plywood held up by springs. The room was tiny with a tiny window. There were greasy fingerprints all over high contact areas. There was a stain on the carpet that my son kept referring to as “the poopy stain” which looked accurate. Old musty looking shower curtain, rust on towel holders. Just overall not the experience I was expecting for the price.",2
Anne S,"Make sure everything works, and if you need something just ask.","We enjoyed the hotel, the location was convenient. Access to everything we were interested in doing was great. The views of Chicago were good. We would stay here again if need be. We would recommend this hotel to others.",1
Mitchell F,Extremely Disappointed!!,This property was an excellent choice for our first trip to Chicago! The centralized location is within walking distance to most places/attractions and also close to train and bus stops. The view from our room was great and the hotel staff were very friendly and helpful with anything we needed. We will most definitely be back to the River Hotel in the future.,3
Jasmine G,TOP TIER,Everyone was so nice and friendly. It was in a great location. The bed was ok. The pillow was a little to firm for me but overall the room was nice. I liked that they had water that you could put in bottles to take with you.,4
Journey458289,Great hotel,"I've stayed here before. And the cleanliness, area, and location keep me coming back. BUT I feel in time certain things in the room need to be fixed or replaced. Plus you have to ask for everything in room room, like iron, ironing board, kitchenware utensils, which is fine, but takes a while sometimes. The TV remotes only worked sometimes. I was able to sign into Netflix, but unable to sign out. And all the outlets in my headboard and night stand were not working. Uploading the app was pointless because it asks for a reservation code, a confirmation code, and I just wound up going to one of the kiosks upon arrival anyways.",5
morganaromanowski,"Great hotel, wonderful front desk staff",We paid over $200 for a room at this “beautiful” hotel. We got to our room and there were NO WINDOWS. We were on the 10th floor. We felt like we slept in a basement. There was also no mini fridge so our food went to waste. We called and asked if we could upgrade and they said there were no rooms available. But all of the other rooms on our floor had no occupancy all night?? Absolute waste of money.,3
sarahE6579EM,Good for the money,"I am an extremely picky person and I LOVED this hotel! If you have a family you wont regret staying here I promise! Best hotel I have ever stayed in by far. They make everything convenient for you, the check in is a breeze (you can check in from your phone), the hotel is separated by two sides which makes elevators quick and not crowded and they're room key operated so you don't have to worry about a bunch of random people running the floors of your hotel. They have water stations with purified water on each floor and offer new clean water bottles for you to fill up. Also whenever you need room service you can simply send a text message and they will bring whatever you need to your room, you never have to go to the front desk. The bedding is luxury and the most comfortable I",3
hend0428,parking garage/outdate rooms,"Overall we had a great stay. HVAC was a little noisy (rattling sound) in one of our two rooms, but that's the only complaint. I didn't bring it up to the staff, though. Staff was super friendly and helpful, location is great. Everything seemed very clean.",5
Kathy F,River Hotel in 2021,"We will be back! Got our room with a view like we asked for which we really appreciated. Had an issue with my card declining upon check in because I forgot to raise my daily limit, the guy at the front desk was VERY helpful and kind with the whole thing. View was amazing. We loved it all",5
teskridge64,Review of River Hotel,"Overall this was a good stay! the location and staff were awesome. The rooms just felt dirty with stained sheets and the corner of the room had a very dirty wall and floor. You can’t beat the price for this location, we were able to walk all over and I felt very safe in the hotel.",3
413aubrey,Good stay,"AC didn't work, light was out in bathroom. Rooms are very outdated and you pay a premium for that. We had parking included/booked directly with hotel and Bell Staff told us the wrong parking address so we got an unexpected $150 charge. When we told the manager this upon check out, I was told we should have checked in with the front desk. I guess it was our fault the bell staff didn't give the correct information out.",2
rsamuelson79,Great Price and Location,"We visited River Hotel during the week of May 17th, 2021 and were very impressed with their COVID protocols. They have taken every precaution to make their patrons' stay as safe as possible while also having an amazing stay. Upon our arrival, we were greeted by Danny who helped us with registration. He was extremely helpful and courteous. He made sure to give us a room with a view of the Chicago River and answered all our questions during our stay. Our room location was quiet the our entire stay. We truly appreciated his hospitality along with the rest of the staff. A big plus is that he is bilingual in Spanish so we got to practice with him. We look forward to a future stay at the River Hotel and hope to have Danny be there to welcome us!",1
