Reviewer,Title,Review,Rating
Carlo,Nice alternative,"We came to River Hotel after an 8 hours journey from Minneapolis. We made our reservation through Bookings.com. When we attempted to check in we were told that one of our room reservations was missing. After a long discussion we were able to convince the staff that the reservation did exist and was already paid for. When we took our rooms we were shocked to see that we could not see outside--that is how dirty the windows were. One of the rooms had a toilet left with excrement residues. The coffee machine was broken. The heating did not function. When we complained and finally decided to call Bookings.com, we were given the option of 'take it or leave it!' Bookings attempted to redirect us to another hotel some one hour outside of Chicago at a neighborhood called Garfield",5
murtscru,Great Location,"Beautiful 'old' yet new, quiet place to stay in busy downtown Chicago. (cool old post box - for mailing letters - next to the elevators.... and gorgeous architecture throughout!) Mine was only one of two rooms on the 38th floor, with a beautiful view of the river. The happy hour was a nice touch... with better than average pours to be taken back to my room as I got ready for dinner. Close to everything, but a quiet corner to recoup from a busy work day!",5
PBOGoingPlaces,Towering heights,"Great place! Small hotel, very quiet. Perfect location and great price. Lots of little extras. A free wine hour, a snack bar with tasty treats for each mealtime. The best was the bottle filler on each floor. I would stay here again!",3
Kermit753,"Great hotel, great location.","Chicago is a regular destination for business for me. This hotel is a great alternative when the other chains are full or rates are to high. Nice rooms, staff, and amenities. Enjoyed the free coffee in the morning, and wine/snacks in the evening. Room views are awesome. The one complaint beds are lumpy.",2
Elle_01234,"Good value for money, amazing location","Great central location. Good basic hotel. Room I stayed in was reasonably sized. Office table chair didn’t work well and was stuck in the ‘down’ position. Bathroom wasn’t 100% clean with fittings under sink a bit grimy. Hotel a bit dated and the door staff probably want to be a bit friendlier. First World problems but when you’re paying good money you want the room to be excellent, not average.",1
Woodland42,Good but the rooms are tiny,"This place is great. We stayed in one of the tiny rooms in the tower. The room was well-equipped for the small space. They did a great job of including everything you need in that small space. I would have given them a rating of 5, but the bed wasn't that great. It was comfortable, but if either of us moved, the whole bed shook. Makes for a not-so-great night of sleep if you're not used to that sort of thing. I feel that if they would invest in a better bed, that place would be a 5 for sure. The 2nd floor free coffee and snacks were greatly appreciated. Everything else was spot on.",3
Lisa richards,Good stay,"I stayed three nights at this hotel on a recent business trip. The location was great--walkable to a bunch of restaurants and touristy locations. The room had everything I needed. Nice desk area, clean bathroom, fridge and microwave. I appreciated the filtered water station in the hallway. The staff was excellent both when checking in and when I was leaving. I'd definitely stay here again.",4
MariPTravels,Concert with a One Night Stay!,"The best feature of this hotel is its location. It is within walking distance from most major attractions, restaurants and shops. To your left there is a 7-11. To your right there is Corner bakery, a sea food restaurant, a Fannie May, a Starbucks, a protein bar etc. The Magnificent mile, the Millennium park, the Art Institute, the river walk, the 360, the water tower, the lake and the Loop (with street sculptures and theaters) are walking distance from the hotel. The standard room that I stayed in was clean, it had a fridge for your stuff, and filtered water across the elevators. Everything worked just fine. I would say that the hotel and the rooms seem a little tired and out of date. Also, the shower was either too hot or too cold, it was a bit difficult to get the right",5
janetB05,Nurse seminar,"First of all the positives - friendly staff, great location on the river and close to N Michigan Ave. I liked the guest lounge on floor 2 with free coffees and snacks, and also the water filling stations on each floor. That was a huge bonus. The downside was the size of the rooms. I stayed in a club room with a queen bed and it was like staying in a wardrobe. The closet was tiny and weirdly there was a yoga mat in there - but there was no space in the room to even use it!",3
FarAway42343155810,Loved it.,"Great location, clean rooms, good view. Would recommend and stay again! Blues club are proximate and a big range of restaurants around. Everything was walking distance. Check in was quick and easy as well as check out.",3
JCSdc,"Quaint, unassuming and great location","My husband and I attended a concert at the Chicago Theater and stayed at the River Hotel for the night. The check in and valet were seamless. The staff is friendly. The hotel was a 3 to 4 block walk to the theater which was super convenient. The decor and room was beautiful. I didn’t take pictures of the room which is surprising since I typically do, but you won’t be disappointed. No tub. Stand up shower only. Clean and modern! We will definitely come back to this hotel.",5
ttamian83,Great Establishment!,"Excellent location. Upon checking in, staff are professional and efficient. I had a great view of the Chicago River. On the second floor there were beverages and snacks. Also, bottled water free of charge. I highly recommend and will be a returning customer on my next business trip.",5
amberjayf,The Chicago Loop,"The location is awesome! The staff is amazingly accommodating and helpful. The hotel was very clean and the views are amazing. My room was cozy, but not too small. Just right for this trip. I will definitely be returning!",3
Getaway36388702812,Poor conditions!,"The River Hotel knows itself. It knows what travelers need and want and it does it at a great price. Great location, wonderful views of the river. Attentive check in staff. Clean and functional rooms and no issues with external noise. I love this place and like how close it gets to to most places in the Loop. Already looking forward to my next visit.",2
Jordan T,"Great value, accommodating to baby!","I couldn't have asked for a better experience. The people at the desk were more than friendly. Other than a dirty window that killed the view a little bit, I have no complaints and would happily stay there again. In fact, I'm planning my honeymoon in Chicago and have full plans on returning to this hotel.",1
Grit,River Hotel or Club Quarters?,I've stayed at the River Hotel twice now and both times we had great experiences. We were lucky enough to have great views on both occasions. You really can't beat the location and the staff are friendly and effective.,3
Discover21799882769,Excellent,Hotel staff extremely rude would not help us with are room it was 78 degrees sleeping was very difficult air conditioning did not work staff would not move us or comp us multiple people in the hotel was in the same situation are stay was for 2 days was not enjoyable.,4
TravelingIman,Bad rooms,"Great value for the location, cleanliness, and staff assistance. Valet is less than helpful and expensive (in fairness it’s average based on neighboring rates). Smaller rooms, but it’s ok for the price. Elevators are very slow. Overall I was satisfied with the stay. They were VERY ACCOMPDATING FOR BABY. Provided high chair and pack-n-play.",5
Brooks,Great Stay - Great Staff,"For the second time, I reserved with River Hotel but was checked in to Club Quarters. The difference? CQ rooms are on the higher floors - which is a problem when occupancy is high and one of the elevators is out. (Not an issue this time!) Updated rooms are nice enough, though small. Clean. Attentive staff. Un-fussy option in a convenient location.",3
Adventure64296773240,"Great location, poor rooms",Everyone was extremely helpful and friendly! Hotel was within walking distance of everything we needed! Front desk showed us where we needed to go and also provided bandaids for me when I didn’t have any!,3
Flyer24348983124,Very nice especially for the price!,"If you would like to stay in a room that has the decor of a dirty 80s room with annoyingly white lighting, then please be my guest! Staff is nice though and I did appreciate the complimentary coffee, fruit and snacks on the 2nd floor.",5
Ann1958_12,3 nights in Chicago,This hotel was the perfect place to stay on my business trip. Room was great. Great location. Staff was very accommodating (Pedro was excellent) and went out of their way to be helpful. I highly recommend this hotel for business travel.,5
Autumn K,BE WEARY OF ELEVATORS,"Location was great, rooms were average with below average bedding. Parts of drawers were coming off, restaurant was no longer on site, which we anticipated for dinner. Staff was very friendly and helpful though.",3
Rioja42,only basic services,"I was very satisfied with this hotel. Especially for the price. Free snacks. Free water on every floor. AMAZING views of the river. I loved it and will be going back! Some features that this hotel has are very nice as well. You can check in and check out on the go. Without ever needing to go to the front desk. You can use your smartphone as the key to your room. You can pair your phone with their TV's. It's all very nice. I booked through Greyhound, which I recommend since you don't have to ride the Greyhound in order to book the hotel, and I only paid $150 for 2 nights. One thing to note is that they take a deposit out when you check in. I didn't know that, I assumed that I would just be charged for any fees when I check out. My deposit was for $90. But I immediately got it",2
SuperRay,Great Hotel,"On arrival at the hotel, check in was quick and smooth and we had a room on the 19th floor. The room was more than adequate for our needs, the huge queen size bed incredibly comfortable. The bathroom was spacious and very clean. The staff were friendly and efficient, nothing seemed to much bother. The location is very good, very easy to get around. It is a shame that the in-hotel restaurant was closed for renovation, but there are plenty of other places to eat in the vicinity. One slight complaint would be the draughty window in the room. All in all I would thoroughly recommend this hotel.",1
Liubov C,Mini-vacations,"Everything was okay until we decided to leave after a one night stay. We got in the elevator to get our stuff so we could leave. The elevator went up very fast 17 floors and then fell down to the 11th floor. Thank god the elevator stopped and we didn't fall all of the way down to the bottom. Were then stuck for 30-45 mins. They were fast to help us get out but the fact is I am traumatized. I can't sleep, I keep having dream I am in a falling elevator. My anxiety is at an all time high! They refunded us but that doesn't give me my piece of mind back or change the fact I am forever traumatized. Getting stuck is one thing, but when you fall not knowing if its going to stop is the worst feeling I have ever had! Also, everything is room was dusty and didn't look clean. The glass",3
Mathyew,Very Good Option for Chicago,"In a partially updated old building, this hotel offers you basi cervices. The rooms are small, the bathrooms gives you minimum confort and the only positive asppect is the location, at the heart of Chicago and at the beginning of the Magnificent Mile. If you are in a short budget trip, is the kind of hotel you have to choose. If you are looking for something very little better, please choose any other hote in Chicago. It was a poor experience.",4
PageyMoon,Favorite Hotel in Chicago,"I’m just going to come out and say it. The River Hotel is amazing. Great location with an incredible view of the Chicago River, bridges, and skyscrapers. The $10 a night upgrade to a superior room was worth every penny. A super comfortable bed, a mini fridge, a coffee maker, and a microwave were nice surprises. Thank you, Ryan for taking care of me during check in. You made it smooth and easy. The second floor lounge with coffee and snacks was a great bonus, as was the M-Th wine and cheese happy hour from 5-6. All in all, one of my best hotel stays ever. No complaints at all. Every staff member that I encountered treated me like gold. If you’re looking for a quality stay, and a great location, this is the place for you! I will definitely return to the River Hotel when I come",5
Marcia33303631,Very nice...,"Perfect hotel: great location, very attentive staff, clean, quiet. It was our anniversary, at the check-in we got a complimentary upgrade for a better room with a view, Pedro is such a professional at details. We loved our stay all the way, delicious food at the next door Land&Lake restaurant. No doubt where to stay next time!",3
Oregon-weirdo,Great Location,"I spent one night there to attend a show in the city. The location is great - right on the river - near Michigan Ave. There are several restaurants/cafes nearby. The L isn't far either. The staff was very friendly and efficient. My room was small without a view, but that was fine. I chose it for the lower price.",3
HockeyMark,River Hotel - Chicago,"I had the pleasure of staying here in one of the small rooms in the ""spire"" of the historic building, and it was a fantastic experience. Yes, the room was small and oddly-shaped, but the view was incredible, it was very clean and well-maintained, and it had every amenity I could want - fridge, microwave, smart TV, comfortable bed, and fast wifi. The living room with complementary snacks that change throughout the day, espresso drinks, and soda was a very nice perk. There are filtered water stations with refillable bottles throughout the hotel. During the week, there's even complementary wine in the lobby. The location is second to none and close to everything downtown and public transit. It's not ultra-luxury, but I would recommend this hotel to anyone looking for a comfortable",5
Maps07565209193,Couldn't ask for more!,"As a last minute reservation I didn’t expect too much of this hotel but I was gladly surprised. Excellent location, a great view, nice staff, a good room and a fair price for all it’s offered. I will sure be back.",5
Jet61340426267,Best stay ever!,Very nice hotel.. excellent staff. Room was very clean and nicely appointed. The shower was a little cramped and odd shaped. But it was really nice overall...including evening wine. Will come back in the future.,3
Cave_liberator,Great hotel with great customer service.,"My wife & I stayed at this hotel for a couple of nites while visiting Chicago. We were there for a couple of sporting events - Bears & Hawks games. I don't think you could beat the value - This places provides great bang for your buck. The location is right on the river at the North Loop. Everything downtown was in withing walking distance to the Hotel. As well, the trail station(s) are located a quick walk from the hotel. The location made our stay that much better! The staff was friendly and the rooms were nice and clean. There are a ton of hotels in Chicago - However, i'm not sure the value could be matched. I wouldn't hesitate to stay here again. Thanks for a great stay!",2
Joeshmeau,WOW!,We loved everything about our stay at the River Hotel. This location could not be more perfect with an excellent view and within walking distance to so many amazing things. The room was in excellent condition and the staff was helpful and responsive to our questions about the city.,1
AK1,NYE in Chicago!,"Fantastic everything. Flexible staff, internet, creature comforts. Filtered water outlets on every floor. Wonderful bed. Beautiful building. Prime Chicago location. Best week in our 10 week journey around America.",3
Ron J,"Great price, location","Great hotel, fair pricing and great location. From the front desk to maintenance, customer service was top notch. Some of the rooms can be small, or oddly shaped, but it didn't bother me as the beds, and over sized tv, plus great service made up for it.",4
Cathy C,Love Chicago,"Given the location, the quality of service, the courtesy, the upkeep (crisp!) and the size of the room (a double bedroom/double bath in our case), it's hard to believe the modest price we paid!!! EVERYONE in the hotel (staff from top to bottom) is friendly and offers assistance and kindness. Extra credit for the building's historic value! Our only very small negs are difficulty in operating the high-tech TV's (we're not tech savvy, in fairness), and no partition or door between the two bedrooms which seemed a little funky. Still 5 stars, though!!! Flight crews in and out of the place constantly for layovers - what more do you need to know?",5
Greg F,Location Location Location with Great Room,"Great location at the Chicago River. We felt very safe walking around the area. Very close to the Magnificent Mile (shopping and restaurants) and Millennium Park (and the other adjacent parks). Room was clean, modern, and comfortable. They had a filtered water dispenser with empty bottles on our floor (10th). It’s a smaller hotel so you don’t have to walk far down hallways. They had a guest supply closet so you could just grab whatever you needed. At least one airline uses this hotel for their pilots/air crew. Club Quarters Hotel is also in this same building. Up to the 10th floor is the River Hotel and everything above is Club Quarters. Tip: Uber navigation kept taking us to Lower Wacker and it took a while for a couple drivers to figure out how to get out of there. Make sure",3
wolverine331,Great Location for a Great Price,"A perfect location in a great city at an affordable rate. This hotel is just off Michigan Avenue and looks down on the Chicago River. Many, many restaurants are nearby. And the Art Institute and Writers Museum are an easy walk from the front door. What could be better!....",3
Curious33777922855,Great hotel,"We have only stayed at Club Quarters on Wacker twice but both times were exceptional. Early check-in and by early I mean 10 am. Knowledgeable staff, helpful and professional. Very clean and well accommodated rooms.",5
Jet29989357487,As it should be,"The location of River Hotel and it's hotel next door Club Quarters are perfect for people trying to do a number of different things in the city. It's only a few blocks away from the theater district for catching a musical/play. Again only a few blocks away in another direction if you want to catch a concert at House of Blues. Michigan Avenue and the Mag Mile, yes only a block away, so you can shop, shop, shop. Millennium Park is short walk down Michigan Ave as well with the Art Institute close by. Parking has in and out privileges, but really there is no need to take it out till you leave because your walking is so centralized here there is no need to drive. I used to stay in a different hotels each trip to Chicago, but this is now my hotel of choice in the city.",5
Jamie W,Weekend getaway,"Amazing location within a half mile walking distance to many great Chicago locations like Millennium Park, Grant Park, the Chicago Federal Reserve, the theatre district, and shopping. Hotel is clean, staff was friendly, and everything went well. Many snacks and drinks were provided free of charge on the 2nd floor. The only issue we had was we were called at 12:30am in our room by the front desk to explain that we weren't actually checked in when we checked in. They were calling to make sure we were actually there. My wife and I were both sleeping and were woken up by the call. I feel like this could have been done differently (maybe call in the morning or slip a note under the door) but because we were tired we were able to go right back to sleep and therefore didn't make",3
hannahkrumrey,"Good, but not first choice","Our first trip to Chicago was amazing. The hotel was very convenient to shopping, restaurants, and sites p. The staff was always very friendly accommodating. Great place to stay. I would definitely stay here again.",2
Opinion011,Great Value for City Visit,Room with a view of the river. Easy access to central Chicago. Extremely helpful and friendly parking attendants who will go above and beyond. I will definitely stay again and recommend to anyone who is looking to stay in riverwalk,1
Sunshine24165721152,Highly Recommend,"Perfect location, nice room, and very reasonable price. The only parking they offer is ballet which is $53 a night. Fairly good price considering where are you are and how much other places charge. Will definitely be staying there the next time I come in town.",3
wearytraveler15,Great Value in an Even Better Location,"Me and a friend stayed at the River Hotel for 3 nights. I had booked a Superior Room with Kitchenette. Check in was very easy, as I was able to do it straight from my phone. Once we arrived and got into the hotel room, I noticed we had absolutely no view; something was basically blocking us from seeing anything. Unsatisfied, I asked to be moved to a room with a view. There were none available until the following night, but they did transfer us to that room once it became available, at no charge. Our rooms were good sizes, however the bathrooms were a little small. Rooms do have televisions you can connect your phone to in order to watch Netflix, which was nice too. Also, all staff members were very friendly and helpful. Overall, you get what you pay for. The hotel is in the",4
networkconnect7,Thank you Pedro & Sierra !,We have stayed at River Hotel twice in the autumn and holiday season and it is the perfect hotel if you do not want to spend a lot of money and be in a good location close to everything. Rooms have contemporary decor and hotel is quiet. Pedro checked with us to be sure we had a nice stay. Will go back again for sure.,5
Slotsy,"Clean, Convenient, Professional",This hotel staff is what actually made me give them a 10. The rooms were nice but the staff was so knowledgeable and helpful it made the whole process smooth especially for someone who doesn’t go to Chicago,3
Nomad18465399412,Not 100% happy but good,"The rooms are on the smaller side, but everything else is perfect for business travel to Chicago. The location is very convenient for reaching the L train, and there are countless opportunities for food and local attractions within walking distance. Staff is friendly and very helpful, and the snacks and coffee added a nice touch!",3
Aqidwai,10 day stay.,"Dear Sir/Madam, All too often we spend time on complaints forgetting the good that needs worthy applause. I recently had the kind opportunity to stay at your Club Quarters on Wacker Street in Chicago, IL and met your Manager Pedro. He was tremendous. He is a model professional. He was so welcoming he took my bags from the lobby to my room, carrying them into the room itself. He is attentive, charismatic and caring. He is a good character. A model more institutions can learn from indeed. Pedro is an asset to your organization and I sincerely thank him for his nature and goodwill. Please let me know if I can be of any help. Best wishes, Dr Raj 305-989-0001 PS: I must thank and appreciate Sierra as well. She guided me in about the local restaurants, night life activities and",5
Gardendiva2,The best secret in Chicago,"The rooms are nice, the lobby has convenient places to work or sit, and the wine hour is fantastic. The water bottles to go are a great feature, and the service is always fast and professional. I will stay here again on my next business trip.",5
Ms Cateyez R,The location is great,It would have been nice to know that the restaurant was closed prior to my visit and also the parking was not handled well. Check-In people seemed like they just wanted me to go away and did not take time to explain anything to me regarding the amenities.,3
helen b,Shabby,"Loved it! Simplistic, no nonsense hotel accomodations in the heart of the 3rd largest city of our country. The idea of munchies for breakfast if fabulous, coffee available 24/7 was the best tasting. Wine and cheese in the evening were a nice touch and above all the staff was happy, very hard working and nice people.",2
C4072CXkarenm,"Compact, but complete","The hotel is in the best location. Walking distance to do many places that you want to see as well as close access to public transportation. Awhile the rooms are smaller than most American hotels, the rooms are comfortable. The beds are the best I have slept in. The linens reminded me of the sheets that my grandma ironed. If that is not enough, the staff is wonderful. Always ready to help and make your stay the best. I have stayed here a few times and have never be disappointed. I often think that I should try another hotel just for the experience but am afraid of being disappointed.",1
Peggy R,Great stay,"The location is what made me rate the hotel 3 stars. However the hotel is old and the rooms are rarely small. Our room had no view just a view of a building wall which was disappointing because the area is beautiful. We paid for a queen size bed but got a full size instead. Our didn’t have a microwave or a refrigerator but our friend’s room did and paid the same price.They offer free sodas, coffee, nuts, and m&ms on the second floor but other than that there’s nothing fascinating about the hotel. If you just stay they for a place to stay then this is it but if you want a luxury hotel try the London House next door its gorgeous.",3
